[
  { "id": "grail", "name": "Grail", "tier": "Pantheon", "description": "Seated king/sovereign. Cody 2026." },
  { "id": "patriarch", "name": "Patriarch", "tier": "Pantheon", "description": "Household / lineage authority. Roman Reigns." },
  { "id": "aitu", "name": "Aitu", "tier": "Pantheon", "description": "Polynesian malevolent ancestral spirit. Jacob Fatu." },
  { "id": "bound-loki", "name": "Bound Loki", "tier": "Pantheon", "description": "Trickster who founds the next devourer; must be solo to be the offering. Seth Rollins." },
  { "id": "devourer-rising", "name": "Devourer Rising", "tier": "Pantheon", "description": "Monster being made. Bron Breakker." },
  { "id": "career-killer", "name": "Career Killer", "tier": "Pantheon", "description": "Sickle archetype — works on declining vessels. Gunther." },
  { "id": "nemesis", "name": "Nemesis", "tier": "Pantheon", "description": "Retributive force. Becky Lynch." },
  { "id": "onryo", "name": "Onryō", "tier": "Pantheon", "description": "Vengeful Japanese ghost; with senpai-authority overlay. Asuka." },
  { "id": "bride-who-became-queen", "name": "Bride Who Became Queen", "tier": "Pantheon", "description": "Sovereignty arc. IYO Sky." },
  { "id": "ascending-orisha", "name": "Ascending Orisha", "tier": "Pantheon", "description": "Yoruba deity-in-rise; credential-stack streak. Oba Femi." },
  { "id": "macha", "name": "Macha (Morrigan)", "tier": "Pantheon", "description": "Sovereign-warrior aspect. Rhea Ripley." },
  { "id": "badb", "name": "Badb (Morrigan)", "tier": "Constant", "description": "Battle-crow aspect. Lyra Valkyria." },
  { "id": "inanna", "name": "Inanna", "tier": "Constant", "description": "Queen-coven leader. Liv Morgan." },
  { "id": "false-god-influencer", "name": "False God / Influencer", "tier": "Pantheon", "description": "Aphrodite-corrupted-male; brittle in front of unified crowd. Logan Paul." },
  { "id": "wise-man", "name": "Wise Man / Operator", "tier": "Pantheon", "description": "Heyman archetype." },
  { "id": "disposable", "name": "Disposable", "tier": "Constant", "description": "Operative-class L-taker. Austin Theory." },
  { "id": "orphic-bard", "name": "Orphic Bard", "tier": "Liminal-Warrior", "description": "Singer who turns the room into a congregation. Joe Hendry." },
  { "id": "liminal-warrior", "name": "Liminal Warrior", "tier": "Liminal-Warrior", "description": "Rising vessel between Constant and Pantheon. Sol Ruca, Je'Von Evans." },
  { "id": "fomorian-exile", "name": "Fomorian Exile", "tier": "Constant", "description": "Ejected court-host. Finn Bálor." },
  { "id": "lucha-warrior", "name": "Lucha Warrior", "tier": "Constant", "description": "Mexican mat-tradition vessel. Penta." },
  { "id": "gatekeeper-institution", "name": "Gatekeeper / Institution", "tier": "Constant", "description": "On-screen authority absorbing institutional cost. Adam Pearce." },
  { "id": "og-el-grande-americano", "name": "OG El Grande Americano", "tier": "Constant", "description": "Mask-lineage carrier; recursive cultural register. Chad Gable." },
  { "id": "jd-apprentice", "name": "JD Apprentice", "tier": "Constant", "description": "Roxanne Perez." },
  { "id": "jd-enforcer", "name": "JD Enforcer", "tier": "Constant", "description": "Raquel Rodriguez." },
  { "id": "enforcer-muscle", "name": "Enforcer / Muscle", "tier": "Constant", "description": "Heel-pairing physical anchor. Rusev." }
]
